{
  "schemaVersion": 10,
  "source": {
    "command": "report-cells"
  },
  "inputs": {
    "runs": [
      {
        "name": "run1",
        "label": "test/fixtures/yuurei-cell/cell-real-run-a",
        "runId": "20260928T192601Z-a64f",
        "cellId": "cell_20260928T192601Z-294f55bd",
        "taskDigest": "sha256:03f634b4c29abcb6bcfb781859c43982ddf747447930fe60b47a4bbc29aa6220",
        "profileName": "fixture-claude",
        "profileDigest": "sha256:0000",
        "runtimeId": "claude-code",
        "requestedCellDigest": "sha256:826925f4971619f1dd7d0b961f3301af9b301ed6d98b68e500490d2a336cf825",
        "observationStatus": "recorded",
        "exportObservedSnapshotId": "obs_96c8c3c142c5",
        "exportResolvedSnapshotId": "res_7aa8f3eaa36d"
      },
      {
        "name": "run2",
        "label": "test/fixtures/yuurei-cell/cell-real-run-b",
        "runId": "20260928T192601Z-7ace",
        "cellId": "cell_20260928T192601Z-c50ffad2",
        "taskDigest": "sha256:03f634b4c29abcb6bcfb781859c43982ddf747447930fe60b47a4bbc29aa6220",
        "profileName": "fixture-claude",
        "profileDigest": "sha256:0000",
        "runtimeId": "claude-code",
        "requestedCellDigest": "sha256:826925f4971619f1dd7d0b961f3301af9b301ed6d98b68e500490d2a336cf825",
        "observationStatus": "recorded",
        "exportObservedSnapshotId": "obs_68ae20c59b46",
        "exportResolvedSnapshotId": "res_d05b18be3493"
      },
      {
        "name": "run3",
        "label": "test/fixtures/yuurei-cell/cell-real-run-c",
        "runId": "20260928T192342Z-0adc",
        "cellId": "cell_20260928T192342Z-c0ead3aa",
        "taskDigest": "sha256:03f634b4c29abcb6bcfb781859c43982ddf747447930fe60b47a4bbc29aa6220",
        "profileName": "fixture-claude",
        "profileDigest": "sha256:0000",
        "runtimeId": "claude-code",
        "requestedCellDigest": "sha256:960c8ad0a2e126b92adb8fbea496a9f17b44464ca8f9d65d8b10f90499468a02",
        "observationStatus": "recorded",
        "exportObservedSnapshotId": "obs_7dd9e1e890a4",
        "exportResolvedSnapshotId": "res_a6a3fe7613f9"
      }
    ]
  },
  "entries": [
    {
      "lane": "association",
      "subject": "run1",
      "id": "association.cell-id",
      "state": "recorded",
      "completeness": "complete",
      "statement": "the trace records cell_id 'cell_20260928T192601Z-294f55bd'",
      "evidence": [
        {
          "source": "run1Trace",
          "pointer": "/cell_id"
        }
      ],
      "provenance": {
        "transform": [
          "report-cells",
          "entry:association.cell-id"
        ]
      }
    },
    {
      "lane": "association",
      "subject": "run1",
      "id": "association.observation",
      "state": "recorded",
      "completeness": "complete",
      "statement": "the observation record reports status 'recorded' from observer 'pfl' 1.2.0",
      "evidence": [
        {
          "source": "run1Trace",
          "pointer": "/observation/observer/id"
        },
        {
          "source": "run1Trace",
          "pointer": "/observation/status"
        }
      ],
      "provenance": {
        "transform": [
          "report-cells",
          "entry:association.observation"
        ]
      }
    },
    {
      "lane": "association",
      "subject": "run1",
      "id": "association.export-retained",
      "state": "verified",
      "completeness": "complete",
      "statement": "the manifest retains 'observation/export.json' and the stored bytes verify (3827 bytes)",
      "evidence": [
        {
          "source": "run1Trace",
          "pointer": "/observation/artifacts"
        },
        {
          "source": "run1Manifest",
          "pointer": "/artifacts/5",
          "digest": "sha256:dbd9ddc1537228cb0317760480033f75346c4477b044596603f7a2f9dda42927"
        }
      ],
      "provenance": {
        "transform": [
          "report-cells",
          "entry:association.export-retained"
        ]
      }
    },
    {
      "lane": "association",
      "subject": "run1",
      "id": "association.export-document",
      "state": "verified",
      "completeness": "complete",
      "statement": "the retained bytes are a conforming pfl export document (pflVersion '1.2.0', completeness 'complete')",
      "evidence": [
        {
          "source": "run1Trace",
          "pointer": "/observation"
        },
        {
          "source": "run1Manifest",
          "pointer": "/artifacts/5",
          "digest": "sha256:dbd9ddc1537228cb0317760480033f75346c4477b044596603f7a2f9dda42927"
        }
      ],
      "provenance": {
        "transform": [
          "report-cells",
          "entry:association.export-document"
        ]
      }
    },
    {
      "lane": "association",
      "subject": "run1",
      "id": "association.export-binding",
      "state": "verified",
      "completeness": "complete",
      "statement": "the export's recorded cellId 'cell_20260928T192601Z-294f55bd' equals the trace's cell_id — a recorded association between the run and the export's caller-asserted provenance, not proof of observation",
      "evidence": [
        {
          "source": "run1Trace",
          "pointer": "/cell_id"
        },
        {
          "source": "run1Export",
          "pointer": "/data/snapshot/cellId",
          "digest": "sha256:dbd9ddc1537228cb0317760480033f75346c4477b044596603f7a2f9dda42927"
        }
      ],
      "provenance": {
        "transform": [
          "report-cells",
          "entry:association.export-binding"
        ]
      }
    },
    {
      "lane": "association",
      "subject": "run1",
      "id": "association.export-snapshots",
      "state": "verified",
      "completeness": "complete",
      "statement": "the recorded snapshot_ids ('obs_96c8c3c142c5', 'res_7aa8f3eaa36d') equal the export's observed and resolved snapshot ids",
      "evidence": [
        {
          "source": "run1Trace",
          "pointer": "/observation/snapshot_ids"
        },
        {
          "source": "run1Export",
          "pointer": "/data/snapshot/observedSnapshotId",
          "digest": "sha256:dbd9ddc1537228cb0317760480033f75346c4477b044596603f7a2f9dda42927"
        },
        {
          "source": "run1Export",
          "pointer": "/data/snapshot/resolvedSnapshotId",
          "digest": "sha256:dbd9ddc1537228cb0317760480033f75346c4477b044596603f7a2f9dda42927"
        }
      ],
      "provenance": {
        "transform": [
          "report-cells",
          "entry:association.export-snapshots"
        ]
      }
    },
    {
      "lane": "association",
      "subject": "run1",
      "id": "association.export-runtime",
      "state": "verified",
      "completeness": "complete",
      "statement": "the export's runtime.id 'claude-code' equals the trace's runtime.id",
      "evidence": [
        {
          "source": "run1Trace",
          "pointer": "/runtime/id"
        },
        {
          "source": "run1Export",
          "pointer": "/data/runtime/id",
          "digest": "sha256:dbd9ddc1537228cb0317760480033f75346c4477b044596603f7a2f9dda42927"
        }
      ],
      "provenance": {
        "transform": [
          "report-cells",
          "entry:association.export-runtime"
        ]
      }
    },
    {
      "lane": "association",
      "subject": "run1",
      "id": "association.export-completeness",
      "state": "verified",
      "completeness": "complete",
      "statement": "the observation record's completeness 'complete' equals the export's",
      "evidence": [
        {
          "source": "run1Trace",
          "pointer": "/observation/completeness"
        },
        {
          "source": "run1Export",
          "pointer": "/completeness",
          "digest": "sha256:dbd9ddc1537228cb0317760480033f75346c4477b044596603f7a2f9dda42927"
        }
      ],
      "provenance": {
        "transform": [
          "report-cells",
          "entry:association.export-completeness"
        ]
      }
    },
    {
      "lane": "association",
      "subject": "run1",
      "id": "association.export-source-project",
      "state": "verified",
      "completeness": "complete",
      "statement": "the trace's seed record and the retained export declare the same source-project identity 'git-db9acfc85f531c03' (kind 'git-remote') — a recorded agreement between the run's seed record and the caller-asserted provenance the observation carried, not proof the source itself was observed",
      "evidence": [
        {
          "source": "run1Trace",
          "pointer": "/seed/source_project"
        },
        {
          "source": "run1Export",
          "pointer": "/data/snapshot/sourceProject",
          "digest": "sha256:dbd9ddc1537228cb0317760480033f75346c4477b044596603f7a2f9dda42927"
        }
      ],
      "provenance": {
        "transform": [
          "report-cells",
          "entry:association.export-source-project"
        ]
      }
    },
    {
      "lane": "association",
      "subject": "run1",
      "id": "association.record-consistency",
      "state": "verified",
      "completeness": "complete",
      "statement": "the observation record is internally coherent (status 'recorded'); it also declares 2 non-export artifact(s) that are not interpreted",
      "evidence": [
        {
          "source": "run1Trace",
          "pointer": "/observation"
        }
      ],
      "provenance": {
        "transform": [
          "report-cells",
          "entry:association.record-consistency"
        ]
      }
    },
    {
      "lane": "configuration",
      "subject": "run1",
      "id": "configuration.snapshot",
      "state": "recorded",
      "completeness": "complete",
      "statement": "the bound export identifies observed snapshot 'obs_96c8c3c142c5', resolved snapshot 'res_7aa8f3eaa36d', schema '3', captured '2026-09-28T19:26:01.310Z'",
      "evidence": [
        {
          "source": "run1Export",
          "pointer": "/data/snapshot/capturedAt",